Event,Site,Date,Round,White,Black,Result,UTCDate,UTCTime,WhiteElo,BlackElo,WhiteRatingDiff,BlackRatingDiff,ECO,Opening,TimeControl,Termination,Moves
Rated Bullet game,https://lichess.org/nQ1xYNSF,2024.08.01,-,kingskreamer,mysteryvabs,1-0,2024.08.01,00:00:09,2148,2155,+6,-6,B10,Caro-Kann Defense: Accelerated Panov Attack,60+0,Time forfeit,e2e4 c7c6 c2c4 d7d5 c4d5 c6d5 e4d5 d8d5 b1c3 d5d8 f1c4 g8f6 d1b3 e7e6 g1f3 b8c6 c4b5 c8d7 e1g1 a8c8 f1e1 a7a6 b5a4 b7b5 c3b5 a6b5 a4b5 f8e7 f3e5 e8g8 e5d7 d8d7 b3f3 d7c7 b5e2 c6e5 f3g3 e5g6 f2f4 c7f4 g3f4 g6f4 d2d3 f4e2 e1e2 c8c7 c1e3 f8c8 a1f1 f6d5 e3d4 c7c1 g1f2 c1f1 f2f1 d5f4 e2d2 c8c1 f1f2 e7g5 d4e3 h7h6 b2b3 g8h7 g2g3 f4d5 e3g5 h6g5 f2f3 h7g6 g3g4 c1f1 f3e4 d5f4 e4d4 f1c1 b3b4 c1c6 a2a4 f7f6 d4e3 e6e5 b4b5 f4d5 e3e4 c6d6 b5b6 d5e7 b6b7 e7c6 b7b8q c6b8 d2b2 b8d7 b2b7 d6a6 d3d4 a6a4 e4d5 a4d4 d5e6 d7c5 e6e7 c5b7 e7f8 d4f4 f8e7 e5e4 e7f8 e4e3 h2h4 e3e2 h4h5
Rated Bullet game,https://lichess.org/OHjUyPjz,2024.08.01,-,Paparino,Jorge0912,1-0,2024.08.01,00:00:09,1103,1106,+5,-6,B32,Sicilian Defense: Franco-Sicilian Variation,60+0,Time forfeit,e2e4 c7c5 g1f3 b8c6 d2d4 e7e6 d4c5 f8c5 f1b5 d8b6 b5c6 c5f2 e1f1 f2h4 c6d7 c8d7 f3h4 g8f6 d1e2 d7b5 c2c4 a8c8 b2b3 b6d6 b1d2 b5c6 c1b2 c8d8 a1d1 d6f4 h4f3 f6e4 d2e4 c6e4 d1d8 e8d8 b2g7 h8g8 e2d2 d8e7 d2f4 g8g7 f4e4 g7g6 f1f2 f7f5 e4b7 e7f6 h1d1 h7h5 b7c6 f6g7 f3e5 g7h6 c6f3
Rated Bullet game,https://lichess.org/JHXDBvOM,2024.08.01,-,Ahmed7adel77,jcsobarzok,0-1,2024.08.01,00:00:09,674,629,-7,+7,C50,Italian Game: Paris Defense,60+0,Time forfeit,e2e4 e7e5 g1f3 d7d6 f1c4 b8c6 d2d3 f8e7 e1g1 g8f6 c1g5 f6g4 c4b5 e7g5 b5c6 c8d7 c6d7 e8f8 d7g4 c7c6 b1c3 g5h4 f3h4 d8h4 g2g3 h4g5 c3e2 c6c5 e2f4 c5c4 d3c4 d6d5 e4d5 e5e4 d5d6 a8d8 f4d5 e4e3 d5c7 e3e2 d1e2 g5g4 e2g4 d8d7
Rated Bullet game,https://lichess.org/4v0QnPHM,2024.08.01,-,KBG1,Kaara_619,0-1,2024.08.01,00:00:09,2459,2556,-4,+5,B40,"Sicilian Defense: Delayed Alapin Variation, with e6",60+0,Normal,e2e4 c7c5 g1f3 e7e6 c2c3 d7d5 d2d4 d5e4 f3e5 c5d4 f1b5 c8d7 e5d7 b8d7 d1d4 g8f6 c1g5 f8e7 e1g1 a7a6 b5d7 d8d7 g5f6 e7f6 d4e4 e8g8 b1a3 d7d2 e4c2 f8d8 a1d1 d2g5 d1d8 a8d8 f1d1 f6e5 a3c4 e5h2 g1h2 g5h5 h2g3 d8d1 c4e3 d1h1 c2d3 h5g6 g3f3 g6d3
Rated Bullet game,https://lichess.org/G1Zz3T70,2024.08.01,-,Realsam48,segama,0-1,2024.08.01,00:00:09,1527,1500,-6,+6,B10,Caro-Kann Defense: Breyer Variation,60+0,Time forfeit,e2e4 c7c6 d2d3 d7d5 g2g3 g8f6 e4d5 c6d5 f1g2 c8g4 g1f3 e7e6 e1g1 b8c6 h2h3 g4h5 c1g5 h7h6 g5f6 d8f6 g3g4 h5g6 b1c3 c6d4 f3d4 f6d4 c3b5 d4b6 a2a4 a7a6 b5c3 b6b2 c3e2 f8e7 e2f4 g6h7 f4h5 e8g8 a1b1 b2e5 b1b7 e7d6 f1e1 e5c3 d1f3 c3c2 b7b1 c2d3 f3d3 h7d3 b1d1 d3g6 h5g3 d6g3 f2g3 a6a5 g1h2 f8b8 d1b1 b8b1 e1b1 a8c8 b1b5 g8h7 b5a5 c8c4 a5b5 c4a4 b5b2 a4c4 b2f2 g6e4 f2d2 e4g2 h2g2 c4e4 d2d1 h7g6 d1d2 g6f6 d2f2 f6e5 f2d2 d5d4 d2f2 e5d5 f2d2 d5c4 d2f2 d4d3 f2f7 e4e2 g2f1 c4c3 f7c7 c3d2 c7d7 d2e3
